{
  "$schema": "../../../schemas/region.schema.json",
  "id": "region_london",
  "name": {
    "en": "Greater London",
    "de": "Gro√ü-London",
    "fr": "Grand Londres"
  },
  "description": {
    "en": "The fog-shrouded metropolis of the old empire, where Victorian architecture meets post-apocalyptic survival. The Thames runs dark with secrets.",
    "de": "Die nebelverhangene Metropole des alten Imperiums."
  },
  "bounds": {
    "north": 51.7,
    "south": 51.3,
    "east": 0.3,
    "west": -0.5
  },
  "biome": "temperate",
  "continent": "europe",
  "country": "United Kingdom",
  "dangerLevel": 40,
  "recommendedLevel": 20,
  "maxPlayers": 2000,
  "pvpEnabled": true,
  "timeZone": "Europe/London",
  "resources": [
    {
      "id": "res_lon_tech_1",
      "type": "crystal",
      "position": { "lat": 51.5074, "lon": -0.1278 },
      "amount": 4000,
      "regenerationRate": 0.4,
      "harvestDifficulty": 5
    },
    {
      "id": "res_lon_gold_1",
      "type": "gold",
      "position": { "lat": 51.5136, "lon": -0.0890 },
      "amount": 3000,
      "regenerationRate": 0.2,
      "harvestDifficulty": 7
    }
  ],
  "portals": [
    {
      "id": "portal_lon_to_paris",
      "destinationRegionId": "region_paris",
      "position": { "lat": 51.5033, "lon": -0.1195 },
      "portalType": "major",
      "bidirectional": true,
      "travelTime": 40.0,
      "cost": { "gold": 100 }
    },
    {
      "id": "portal_lon_to_ny",
      "destinationRegionId": "region_new_york",
      "position": { "lat": 51.5074, "lon": -0.1278 },
      "portalType": "major",
      "travelTime": 120.0,
      "cost": { "gold": 500, "energy": 100 },
      "requirements": { "minLevel": 20 }
    },
    {
      "id": "portal_lon_to_berlin",
      "destinationRegionId": "region_berlin",
      "position": { "lat": 51.5155, "lon": -0.1419 },
      "portalType": "standard",
      "travelTime": 55.0,
      "cost": { "gold": 120 }
    }
  ],
  "controlPoints": [
    {
      "id": "cp_lon_parliament",
      "name": { "en": "Houses of Parliament", "de": "Parlament" },
      "position": { "lat": 51.4995, "lon": -0.1248 },
      "captureRadius": 100.0,
      "captureTime": 900.0,
      "pointValue": 800,
      "bonuses": { "faction_influence": 1.5, "diplomacy_bonus": 1.3 }
    },
    {
      "id": "cp_lon_tower",
      "name": { "en": "Tower of London", "de": "Tower of London" },
      "position": { "lat": 51.5081, "lon": -0.0759 },
      "captureRadius": 80.0,
      "captureTime": 1200.0,
      "pointValue": 1000,
      "bonuses": { "defense_bonus": 1.5, "treasury_bonus": 1.4 }
    },
    {
      "id": "cp_lon_buckingham",
      "name": { "en": "Buckingham Palace", "de": "Buckingham-Palast" },
      "position": { "lat": 51.5014, "lon": -0.1419 },
      "captureRadius": 120.0,
      "captureTime": 1500.0,
      "pointValue": 1200,
      "bonuses": { "morale": 1.5, "reputation_gain": 1.4 }
    }
  ],
  "spawnPoints": [
    {
      "id": "spawn_lon_underground",
      "position": { "lat": 51.5074, "lon": -0.1278 },
      "radius": 200.0,
      "unitTypes": ["tube_ghoul", "underground_lurker", "plague_rat"],
      "maxActive": 30,
      "spawnRate": 60.0,
      "levelRange": { "min": 15, "max": 30 },
      "schedule": { "timeOfDay": "night" }
    }
  ],
  "landmarks": [
    {
      "id": "landmark_lon_bigben",
      "name": { "en": "Big Ben", "de": "Big Ben" },
      "position": { "lat": 51.5007, "lon": -0.1246 },
      "type": "monument",
      "discoveryRadius": 500.0,
      "explorable": true
    },
    {
      "id": "landmark_lon_bridge",
      "name": { "en": "Tower Bridge", "de": "Tower Bridge" },
      "position": { "lat": 51.5055, "lon": -0.0754 },
      "type": "monument",
      "discoveryRadius": 400.0
    }
  ],
  "weather": {
    "possibleTypes": ["fog", "rain", "drizzle", "cloudy", "clear"],
    "defaultType": "fog",
    "changeInterval": 2400.0,
    "useRealWeather": true,
    "seasonalVariation": true
  },
  "modifiers": {
    "experienceMultiplier": 1.2,
    "lootMultiplier": 1.15,
    "movementMultiplier": 0.95
  },
  "ambience": {
    "daySoundscape": "london_day",
    "nightSoundscape": "london_night_fog",
    "musicTrack": "british_ambience",
    "particleEffects": ["fog_thick", "rain_light"],
    "fogDensity": 0.3
  },
  "tags": ["urban", "major_hub", "portal_hub", "historical", "fog"]
}
