{
  "$schema": "../../../schemas/region.schema.json",
  "id": "region_beijing",
  "name": {
    "en": "Imperial Beijing",
    "zh": "帝都北京"
  },
  "description": {
    "en": "The ancient capital of the Middle Kingdom, where the Forbidden City holds secrets of emperors past and the Great Wall guards against threats from the north.",
    "zh": "中国古都，紫禁城蕴藏着历代皇帝的秘密，长城抵御着来自北方的威胁。"
  },
  "bounds": {
    "north": 40.3,
    "south": 39.6,
    "east": 117.0,
    "west": 115.8
  },
  "biome": "temperate",
  "continent": "asia",
  "country": "China",
  "dangerLevel": 50,
  "recommendedLevel": 30,
  "maxPlayers": 2000,
  "pvpEnabled": true,
  "timeZone": "Asia/Shanghai",
  "resources": [
    {
      "id": "res_bei_jade_1",
      "type": "gems",
      "position": { "lat": 39.9042, "lon": 116.4074 },
      "amount": 5000,
      "regenerationRate": 0.3,
      "harvestDifficulty": 7
    },
    {
      "id": "res_bei_silk_1",
      "type": "special",
      "position": { "lat": 39.9163, "lon": 116.3972 },
      "amount": 8000,
      "regenerationRate": 0.5,
      "harvestDifficulty": 4
    }
  ],
  "portals": [
    {
      "id": "portal_bei_to_tokyo",
      "destinationRegionId": "region_tokyo",
      "position": { "lat": 39.9042, "lon": 116.4074 },
      "portalType": "major",
      "travelTime": 60.0,
      "cost": { "gold": 150 }
    },
    {
      "id": "portal_bei_to_moscow",
      "destinationRegionId": "region_moscow",
      "position": { "lat": 40.4319, "lon": 116.5704 },
      "portalType": "major",
      "travelTime": 150.0,
      "cost": { "gold": 400 },
      "requirements": { "minLevel": 30 }
    },
    {
      "id": "portal_bei_to_shanghai",
      "destinationRegionId": "region_shanghai",
      "position": { "lat": 39.8801, "lon": 116.4074 },
      "portalType": "standard",
      "travelTime": 45.0,
      "cost": { "gold": 80 }
    }
  ],
  "controlPoints": [
    {
      "id": "cp_bei_forbidden_city",
      "name": { "en": "Forbidden City", "zh": "紫禁城" },
      "position": { "lat": 39.9163, "lon": 116.3972 },
      "captureRadius": 200.0,
      "captureTime": 2000.0,
      "pointValue": 1500,
      "bonuses": { "imperial_authority": 2.0, "army_morale": 1.5 }
    },
    {
      "id": "cp_bei_tiananmen",
      "name": { "en": "Tiananmen Square", "zh": "天安门广场" },
      "position": { "lat": 39.9055, "lon": 116.3976 },
      "captureRadius": 150.0,
      "captureTime": 1200.0,
      "pointValue": 1000,
      "bonuses": { "political_power": 1.5 }
    }
  ],
  "spawnPoints": [
    {
      "id": "spawn_bei_warriors",
      "position": { "lat": 39.95, "lon": 116.40 },
      "radius": 200.0,
      "unitTypes": ["imperial_guard", "shaolin_monk", "terracotta_warrior"],
      "maxActive": 25,
      "spawnRate": 120.0,
      "levelRange": { "min": 25, "max": 45 }
    }
  ],
  "landmarks": [
    {
      "id": "landmark_bei_greatwall",
      "name": { "en": "Great Wall of China", "zh": "长城" },
      "position": { "lat": 40.4319, "lon": 116.5704 },
      "type": "monument",
      "discoveryRadius": 2000.0,
      "explorable": true,
      "questGiver": true
    },
    {
      "id": "landmark_bei_temple_heaven",
      "name": { "en": "Temple of Heaven", "zh": "天坛" },
      "position": { "lat": 39.8822, "lon": 116.4066 },
      "type": "monument",
      "discoveryRadius": 500.0,
      "explorable": true
    }
  ],
  "weather": {
    "possibleTypes": ["clear", "smog", "sandstorm", "rain", "snow"],
    "defaultType": "clear",
    "useRealWeather": true,
    "seasonalVariation": true
  },
  "modifiers": {
    "experienceMultiplier": 1.3,
    "lootMultiplier": 1.25
  },
  "tags": ["urban", "historical", "imperial", "martial_arts"]
}
