{
  "$schema": "../../../schemas/region.schema.json",
  "id": "region_vancouver",
  "name": {
    "en": "Pacific Northwest",
    "es": "Pacífico Noroeste"
  },
  "description": {
    "en": "The rain-soaked forests of the northwest coast, where ancient totems guard sacred groves and the mists hide both sanctuary and danger.",
    "es": "Los bosques empapados de lluvia de la costa noroeste, donde antiguos tótems guardan bosques sagrados."
  },
  "bounds": {
    "north": 50.5,
    "south": 48.0,
    "east": -121.5,
    "west": -125.0
  },
  "biome": "temperate",
  "continent": "north_america",
  "country": "Canada",
  "dangerLevel": 35,
  "recommendedLevel": 20,
  "maxPlayers": 1000,
  "pvpEnabled": true,
  "timeZone": "America/Vancouver",
  "resources": [
    {
      "id": "res_van_wood_1",
      "type": "wood",
      "position": { "lat": 49.2827, "lon": -123.1207 },
      "amount": 20000,
      "regenerationRate": 1.5,
      "harvestDifficulty": 3
    }
  ],
  "portals": [
    {
      "id": "portal_van_to_sf",
      "destinationRegionId": "region_san_francisco",
      "position": { "lat": 49.2827, "lon": -123.1207 },
      "portalType": "standard",
      "travelTime": 50.0,
      "cost": { "gold": 100 }
    },
    {
      "id": "portal_van_to_alaska",
      "destinationRegionId": "region_alaska",
      "position": { "lat": 49.8951, "lon": -124.5198 },
      "portalType": "standard",
      "travelTime": 80.0,
      "cost": { "gold": 180 }
    }
  ],
  "weather": {
    "possibleTypes": ["rain", "fog", "cloudy", "drizzle", "clear"],
    "defaultType": "rain",
    "useRealWeather": true
  },
  "modifiers": {
    "experienceMultiplier": 1.15,
    "resourceMultiplier": 1.3
  },
  "tags": ["temperate", "forest", "coastal", "rain_forest"]
}
