{
  "$schema": "../../../schemas/region.schema.json",
  "id": "region_siberia",
  "name": {
    "en": "Siberian Expanse",
    "ru": "Сибирские Просторы"
  },
  "description": {
    "en": "The frozen wasteland stretching endlessly to the horizon. Ancient mammoths still roam the permafrost, and shamans commune with spirits older than memory.",
    "ru": "Замёрзшая пустошь, простирающаяся бесконечно до горизонта."
  },
  "bounds": {
    "north": 77.0,
    "south": 50.0,
    "east": 170.0,
    "west": 60.0
  },
  "biome": "arctic",
  "continent": "asia",
  "country": "Russia",
  "dangerLevel": 75,
  "recommendedLevel": 50,
  "maxPlayers": 600,
  "pvpEnabled": true,
  "timeZone": "Asia/Yakutsk",
  "resources": [
    {
      "id": "res_sib_diamonds_1",
      "type": "gems",
      "position": { "lat": 62.0355, "lon": 129.6755 },
      "amount": 8000,
      "regenerationRate": 0.15,
      "harvestDifficulty": 9
    },
    {
      "id": "res_sib_oil_1",
      "type": "oil",
      "position": { "lat": 61.0, "lon": 73.4 },
      "amount": 50000,
      "regenerationRate": 0.3,
      "harvestDifficulty": 8
    },
    {
      "id": "res_sib_mammoth_1",
      "type": "special",
      "position": { "lat": 70.0, "lon": 135.0 },
      "amount": 200,
      "regenerationRate": 0.01,
      "harvestDifficulty": 10
    }
  ],
  "portals": [
    {
      "id": "portal_sib_to_moscow",
      "destinationRegionId": "region_moscow",
      "position": { "lat": 56.0097, "lon": 92.8520 },
      "portalType": "standard",
      "travelTime": 120.0,
      "cost": { "gold": 300 }
    },
    {
      "id": "portal_sib_to_alaska",
      "destinationRegionId": "region_alaska",
      "position": { "lat": 65.0, "lon": 170.0 },
      "portalType": "ancient",
      "travelTime": 120.0,
      "cost": { "gold": 400 },
      "requirements": { "minLevel": 45 }
    }
  ],
  "spawnPoints": [
    {
      "id": "spawn_sib_mammoths",
      "position": { "lat": 68.0, "lon": 140.0 },
      "radius": 1000.0,
      "unitTypes": ["woolly_mammoth", "mammoth_alpha"],
      "maxActive": 10,
      "spawnRate": 600.0,
      "levelRange": { "min": 45, "max": 60 }
    },
    {
      "id": "spawn_sib_spirits",
      "position": { "lat": 60.0, "lon": 100.0 },
      "radius": 500.0,
      "unitTypes": ["frost_spirit", "nature_elemental", "ancient_shaman"],
      "maxActive": 8,
      "spawnRate": 300.0,
      "levelRange": { "min": 50, "max": 65 }
    }
  ],
  "weather": {
    "possibleTypes": ["snow", "blizzard", "whiteout", "clear", "aurora"],
    "defaultType": "snow",
    "seasonalVariation": true
  },
  "modifiers": {
    "experienceMultiplier": 1.6,
    "lootMultiplier": 1.5,
    "movementMultiplier": 0.4,
    "healingMultiplier": 0.4
  },
  "tags": ["arctic", "wilderness", "extreme", "high_level", "rare_resources"]
}
