{
  "$schema": "../../../schemas/region.schema.json",
  "id": "region_athens",
  "name": {
    "en": "Hellenic Lands",
    "el": "Ελληνικές Χώρες"
  },
  "description": {
    "en": "The cradle of Western civilization, where the temples of the old gods still hold power. Heroes train in the shadows of the Acropolis while mythical creatures prowl the islands.",
    "el": "Η κοιτίδα του δυτικού πολιτισμού, όπου οι ναοί των παλιών θεών κρατούν ακόμα δύναμη."
  },
  "bounds": {
    "north": 41.8,
    "south": 34.8,
    "east": 29.7,
    "west": 19.3
  },
  "biome": "coastal",
  "continent": "europe",
  "country": "Greece",
  "dangerLevel": 45,
  "recommendedLevel": 25,
  "maxPlayers": 1200,
  "pvpEnabled": true,
  "timeZone": "Europe/Athens",
  "resources": [
    {
      "id": "res_gre_marble_1",
      "type": "stone",
      "position": { "lat": 37.9838, "lon": 23.7275 },
      "amount": 10000,
      "regenerationRate": 0.5,
      "harvestDifficulty": 5
    },
    {
      "id": "res_gre_olives_1",
      "type": "food",
      "position": { "lat": 35.2401, "lon": 24.8093 },
      "amount": 10000,
      "regenerationRate": 1.0,
      "harvestDifficulty": 2
    },
    {
      "id": "res_gre_divine_essence",
      "type": "mana",
      "position": { "lat": 39.0742, "lon": 21.8243 },
      "amount": 2000,
      "regenerationRate": 0.2,
      "harvestDifficulty": 8
    }
  ],
  "portals": [
    {
      "id": "portal_gre_to_rome",
      "destinationRegionId": "region_rome",
      "position": { "lat": 37.9838, "lon": 23.7275 },
      "portalType": "ancient",
      "travelTime": 50.0,
      "cost": { "gold": 100 }
    },
    {
      "id": "portal_gre_to_olympus",
      "destinationRegionId": "region_olympus",
      "position": { "lat": 40.0859, "lon": 22.3583 },
      "portalType": "ancient",
      "travelTime": 30.0,
      "cost": { "gold": 300 },
      "requirements": { "minLevel": 40, "questId": "quest_favor_of_gods" }
    },
    {
      "id": "portal_gre_to_egypt",
      "destinationRegionId": "region_egypt",
      "position": { "lat": 35.5138, "lon": 24.0180 },
      "portalType": "ancient",
      "travelTime": 60.0,
      "cost": { "gold": 150 }
    }
  ],
  "controlPoints": [
    {
      "id": "cp_gre_acropolis",
      "name": { "en": "Acropolis", "el": "Ακρόπολη" },
      "position": { "lat": 37.9715, "lon": 23.7257 },
      "captureRadius": 100.0,
      "captureTime": 1000.0,
      "pointValue": 900,
      "bonuses": { "divine_favor": 1.5, "wisdom_bonus": 1.3 }
    },
    {
      "id": "cp_gre_delphi",
      "name": { "en": "Oracle of Delphi", "el": "Μαντείο των Δελφών" },
      "position": { "lat": 38.4824, "lon": 22.5010 },
      "captureRadius": 80.0,
      "captureTime": 1200.0,
      "pointValue": 1100,
      "bonuses": { "prophecy": 2.0, "quest_rewards": 1.4 }
    }
  ],
  "spawnPoints": [
    {
      "id": "spawn_gre_centaurs",
      "position": { "lat": 39.5, "lon": 22.0 },
      "radius": 300.0,
      "unitTypes": ["centaur", "centaur_archer", "centaur_champion"],
      "maxActive": 15,
      "spawnRate": 180.0,
      "levelRange": { "min": 25, "max": 40 }
    },
    {
      "id": "spawn_gre_minotaur",
      "position": { "lat": 35.2401, "lon": 24.8093 },
      "radius": 200.0,
      "unitTypes": ["minotaur"],
      "maxActive": 1,
      "spawnRate": 3600.0,
      "levelRange": { "min": 45, "max": 50 }
    }
  ],
  "landmarks": [
    {
      "id": "landmark_gre_parthenon",
      "name": { "en": "Parthenon", "el": "Παρθενώνας" },
      "position": { "lat": 37.9715, "lon": 23.7267 },
      "type": "monument",
      "discoveryRadius": 500.0,
      "explorable": true,
      "questGiver": true
    }
  ],
  "weather": {
    "possibleTypes": ["sunny", "clear", "rain", "thunderstorm"],
    "defaultType": "sunny",
    "useRealWeather": true
  },
  "modifiers": {
    "experienceMultiplier": 1.25,
    "lootMultiplier": 1.3
  },
  "tags": ["coastal", "mythical", "ancient", "islands", "gods"]
}
