{
  "$schema": "../../../schemas/region.schema.json",
  "id": "region_los_angeles",
  "name": {
    "en": "Los Angeles Basin",
    "es": "Cuenca de Los Angeles"
  },
  "description": {
    "en": "The sun-scorched sprawl of the west coast, where the entertainment industry's ruins hide valuable resources and dangerous gangs roam the endless highways.",
    "es": "La extensa zona quemada por el sol de la costa oeste, donde las ruinas de la industria del entretenimiento esconden valiosos recursos."
  },
  "bounds": {
    "north": 34.3,
    "south": 33.7,
    "east": -117.5,
    "west": -118.7
  },
  "biome": "desert",
  "continent": "north_america",
  "country": "United States",
  "dangerLevel": 40,
  "recommendedLevel": 20,
  "maxPlayers": 1800,
  "pvpEnabled": true,
  "timeZone": "America/Los_Angeles",
  "resources": [
    {
      "id": "res_la_oil_1",
      "type": "oil",
      "position": { "lat": 33.9425, "lon": -118.4081 },
      "amount": 10000,
      "regenerationRate": 0.3,
      "harvestDifficulty": 5
    },
    {
      "id": "res_la_tech_1",
      "type": "crystal",
      "position": { "lat": 34.0522, "lon": -118.2437 },
      "amount": 3000,
      "regenerationRate": 0.4,
      "harvestDifficulty": 6
    }
  ],
  "portals": [
    {
      "id": "portal_la_to_sf",
      "destinationRegionId": "region_san_francisco",
      "position": { "lat": 34.0522, "lon": -118.2437 },
      "portalType": "standard",
      "travelTime": 50.0,
      "cost": { "gold": 100 }
    },
    {
      "id": "portal_la_to_vegas",
      "destinationRegionId": "region_las_vegas",
      "position": { "lat": 34.1478, "lon": -118.1445 },
      "portalType": "standard",
      "travelTime": 40.0,
      "cost": { "gold": 75 }
    },
    {
      "id": "portal_la_to_tokyo",
      "destinationRegionId": "region_tokyo",
      "position": { "lat": 33.7405, "lon": -118.2688 },
      "portalType": "major",
      "travelTime": 150.0,
      "cost": { "gold": 600, "energy": 120 },
      "requirements": { "minLevel": 25 }
    }
  ],
  "controlPoints": [
    {
      "id": "cp_la_hollywood",
      "name": { "en": "Hollywood Hills", "es": "Colinas de Hollywood" },
      "position": { "lat": 34.1341, "lon": -118.3215 },
      "captureRadius": 150.0,
      "captureTime": 500.0,
      "pointValue": 400,
      "bonuses": { "reputation_gain": 1.5 }
    },
    {
      "id": "cp_la_port",
      "name": { "en": "Port of Los Angeles", "es": "Puerto de Los Angeles" },
      "position": { "lat": 33.7393, "lon": -118.2692 },
      "captureRadius": 200.0,
      "captureTime": 700.0,
      "pointValue": 600,
      "bonuses": { "trading_bonus": 1.5, "resource_capacity": 1.3 }
    }
  ],
  "spawnPoints": [
    {
      "id": "spawn_la_highway_raiders",
      "position": { "lat": 34.0195, "lon": -118.4912 },
      "radius": 300.0,
      "unitTypes": ["highway_raider", "biker_gang", "road_warrior"],
      "maxActive": 20,
      "spawnRate": 60.0,
      "levelRange": { "min": 20, "max": 35 }
    }
  ],
  "landmarks": [
    {
      "id": "landmark_la_hollywood_sign",
      "name": { "en": "Hollywood Sign", "es": "Letrero de Hollywood" },
      "position": { "lat": 34.1341, "lon": -118.3215 },
      "type": "monument",
      "discoveryRadius": 800.0
    }
  ],
  "weather": {
    "possibleTypes": ["clear", "heatwave", "smog", "wildfire_smoke"],
    "defaultType": "clear",
    "changeInterval": 7200.0,
    "seasonalVariation": false
  },
  "modifiers": {
    "experienceMultiplier": 1.15,
    "movementMultiplier": 1.1
  },
  "tags": ["urban", "desert", "west_coast", "highway_combat"]
}
