{
  "$schema": "../../../schemas/region.schema.json",
  "id": "region_alps",
  "name": {
    "en": "Alpine Peaks",
    "de": "Alpengipfel",
    "fr": "Sommets Alpins",
    "it": "Vette Alpine"
  },
  "description": {
    "en": "The majestic mountain range spanning multiple nations, where dwarven forges burn deep within ancient mines and dragons nest on the highest peaks.",
    "de": "Das majestätische Gebirge, das mehrere Nationen überspannt."
  },
  "bounds": {
    "north": 47.5,
    "south": 45.5,
    "east": 16.0,
    "west": 6.0
  },
  "biome": "mountain",
  "continent": "europe",
  "country": "Alps Region",
  "dangerLevel": 55,
  "recommendedLevel": 35,
  "maxPlayers": 1000,
  "pvpEnabled": true,
  "timeZone": "Europe/Zurich",
  "resources": [
    {
      "id": "res_alp_iron_1",
      "type": "iron",
      "position": { "lat": 46.8182, "lon": 8.2275 },
      "amount": 18000,
      "regenerationRate": 0.5,
      "harvestDifficulty": 7
    },
    {
      "id": "res_alp_gems_1",
      "type": "gems",
      "position": { "lat": 45.9763, "lon": 7.6586 },
      "amount": 4000,
      "regenerationRate": 0.2,
      "harvestDifficulty": 8
    },
    {
      "id": "res_alp_dragon_ore",
      "type": "special",
      "position": { "lat": 46.5, "lon": 9.8 },
      "amount": 500,
      "regenerationRate": 0.05,
      "harvestDifficulty": 10
    }
  ],
  "portals": [
    {
      "id": "portal_alp_to_paris",
      "destinationRegionId": "region_paris",
      "position": { "lat": 46.2044, "lon": 6.1432 },
      "portalType": "standard",
      "travelTime": 50.0,
      "cost": { "gold": 110 }
    },
    {
      "id": "portal_alp_to_rome",
      "destinationRegionId": "region_rome",
      "position": { "lat": 45.4642, "lon": 9.1900 },
      "portalType": "standard",
      "travelTime": 45.0,
      "cost": { "gold": 100 }
    }
  ],
  "spawnPoints": [
    {
      "id": "spawn_alp_dragons",
      "position": { "lat": 46.5, "lon": 9.5 },
      "radius": 300.0,
      "unitTypes": ["young_dragon", "ice_drake", "elder_dragon"],
      "maxActive": 3,
      "spawnRate": 1800.0,
      "levelRange": { "min": 40, "max": 60 }
    },
    {
      "id": "spawn_alp_dwarves",
      "position": { "lat": 46.0, "lon": 8.0 },
      "radius": 200.0,
      "unitTypes": ["dwarf_miner", "dwarf_warrior", "dwarf_runesmith"],
      "maxActive": 15,
      "spawnRate": 120.0,
      "levelRange": { "min": 30, "max": 45 }
    }
  ],
  "landmarks": [
    {
      "id": "landmark_alp_matterhorn",
      "name": { "en": "Matterhorn", "de": "Matterhorn" },
      "position": { "lat": 45.9763, "lon": 7.6586 },
      "type": "natural",
      "discoveryRadius": 2000.0,
      "explorable": true
    }
  ],
  "weather": {
    "possibleTypes": ["clear", "snow", "blizzard", "avalanche_risk", "fog"],
    "defaultType": "clear",
    "seasonalVariation": true
  },
  "modifiers": {
    "experienceMultiplier": 1.35,
    "lootMultiplier": 1.4,
    "movementMultiplier": 0.5,
    "resourceMultiplier": 1.5
  },
  "tags": ["mountain", "mining", "dragons", "dwarves", "high_altitude"]
}
